{
  "fixture_id": "codebuddy_canceled_protocol_synthetic",
  "layer": "protocol_core",
  "engine": "codebuddy",
  "capability_requirements": [
    "semantic_turn_markers.failed"
  ],
  "inputs": {
    "stdout_file": "stdout.log",
    "stderr": "",
    "status_hint": "canceled"
  },
  "expected": {
    "rasp_events": [],
    "fcmp_events": []
  },
  "normalization": {
    "ignore_fields": ["correlation.session_id"]
  },
  "source": "synthetic_minimal",
  "source_run_id": null
}
